<?xml version="1.0" encoding="UTF-8"?>
<!DOCTYPE Export SYSTEM "../../../DTDs/export.dtd">

<Export from="../Level2/st03/asw_pus_tc_3_31_format.xml" to="../Level1/asw_pus_v2_tc_format.xml">
	<settings>
		<settingFromConst value="0" toFieldRef="CCSDSSecondaryHeaderFlag"/>
		<settingFromConst value="1" toFieldRef="PUSVersion"/>
		<settingFromConst value="11" toFieldRef="ACK"/>
		<settingFromConst value="3" toFieldRef="ServiceType"/>
		<settingFromConst value="6" toFieldRef="ServiceSubtype"/>
		<settingFromConst value="120" toFieldRef="SourceID"/>
		<settingFromField fieldRef="ApplicationData" toFieldRef="ApplicationData"/>
		<settingFromConst value="3" toFieldRef="AppDataLength"/> <!-- Virtual, 1 bytes of EPD PUS TC 3.31 AppData -->
	</settings>
</Export>
