<?xml version="1.0" encoding="UTF-8"?>
<!DOCTYPE Export SYSTEM "../../../DTDs/export.dtd">

<Export from="../Level2/st02/asw_pus_tc_2_1_format.xml" to="../Level1/asw_pus_v2_tc_format.xml">
	<Sizes>
		<sizeInBits id="0" from="DataToWrite" addSize="8" unit="bytes"/>
	</Sizes>

	<settings>
		<settingFromConst value="0" toFieldRef="CCSDSSecondaryHeaderFlag"/>
		<settingFromConst value="1" toFieldRef="PUSVersion"/>
		<settingFromConst value="9" toFieldRef="ACK"/>
		<settingFromConst value="6" toFieldRef="ServiceType"/>
		<settingFromConst value="2" toFieldRef="ServiceSubtype"/>
		<settingFromConst value="120" toFieldRef="SourceID"/>
		<settingFromField fieldRef="ApplicationData" toFieldRef="ApplicationData"/>
		<settingFromSize sizeRef="0" toFieldRef="AppDataLength"/>
	</settings>
</Export>
