<?xml version="1.0" encoding="UTF-8"?>
<!DOCTYPE Export SYSTEM "../../DTDs/export.dtd">
<Export from="NULL" to="asw_pus_6_2.xml">

	<Sizes>
		<sizeFromFileLength id="0" fromFile="STEPS_XML/INPUTS/tc_6_2/bytes_to_write.txt"/>
	</Sizes>

	<settings>
		<settingFromConst value="0" toFieldRef="MemoryID"/>
		<settingFromConst value="1" toFieldRef="N"/>
		<settingFromConst value="0x100" toFieldRef="StartAddress"/>
		<settingFromSize sizeRef="0" toFieldRef="Length"/>
		<settingFromFile file="STEPS_XML/INPUTS/tc_6_2/bytes_to_write.txt" toFieldRef="DataToWrite"/>
	</settings>
</Export>
